annee_scolaire;diplome;libelle_diplome;code_niveau;type_diplome;code_groupe_specialite;libelle_specialite;libelle_specialite_com;id_og;libelle_og;id_etab;nom_complet_cfa;numero_section;duree_formation_mois;annee_formation;id_siteformation;code_uai_site;libelle_lien_cfa;nom_site_formation;adresse1_site;adresse2_site;adresse3_site;code_commune_site_insee;code_postal_site;libelle_ville_site;num_section;age_jeune_decembre;handicap_oui_non_vide;code_sexe;sexe;code_qualite;libelle_qualite;code_nationalite;libelle_nationalite;code_pcs;libelle_pcs_parent;code_statut_jeune;libelle_statut_jeune;code_origine_prec_cfa;libelle_origine_prec_cfa;code_origine_annee_prec;libelle_origine_annee_prec;code_depart_jeune_insee;code_commune_jeune_insee;code_postal_jeune;libelle_ville_jeune;code_naf_entreprise;depart_entreprise;code_insee_entreprise;code_uai_etab_annee_prec
11/12;35031004;Gestion administrative et commerciale (DUT);3;DUT;310;Spécialités plurivalentes des échanges et de la gestion (y compris administr. générale des entreprises et collectivités);Administration et management des entreprises;14;Association pour la Formation Universitaire par l'Apprentissage;14;CFA SUP 2000;74;24;1;897;0782118D;Convention L6231-3;Université de Versailles Saint-Quentin en Yvelines - IUT de Rambouillet;19 allée des Vignes;;;78517;78120;RAMBOUILLET;74;21;;F;Féminin;E;Externe;1;France;99;Non renseigné (inconnu ou sans objet);A;Contrat d'apprentissage;45;TERMINALE PROFESSIONNELLE (2EME ANNEE BAC PRO OU BT) (en lycée);45;TERMINALE PROFESSIONNELLE (2EME ANNEE BAC PRO OU BT) (en lycée);91;91521;91130;RIS-ORANGIS;4669A;91;91377;94
11/12;50033604;Esthétique cosmétique : soins esthétiques - conseils - vente (CAP);5;CAP;336;Coiffure, esthétique, et autres spécialités des services aux personnes;Coiffure, esthétique;39;Association de Formation Coiffure;41;CFA Soins Personnels Coiffure - Ambroise-Croisat;13;24;2;638;0750739W;Local du CFA;CFA de la Coiffure Ambroise Croisat;27 boulevard Ney;;;75118;75018;PARIS;13;18;;F;Féminin;E;Externe;1;France;99;Non renseigné (inconnu ou sans objet);A;Contrat d'apprentissage;15;4EME GENERALE (en collège);73;1ERE ANNEE CAP OU AUTRE DIPLOME DE NIVEAU V (STATUT APPRENTISSAGE);94;94043;94270;LE KREMLIN-BICETRE;9602B;75;75119;75
11/12;25032636;Systèmes informatiques et logiciels spé conception des systèmes d'information, intégration et décision (LP Paris 8);2;LICENCE PRO;326;Informatique, traitement de l'information, réseaux de transmission des données;Informatique, réseaux;101;Association pour la Formation des Informaticiens par l'Apprentissage;140;CFA AFIA;67;12;1;2167;0932214B;Convention L6231-3;IUT de Montreuil;140 rue de la Nouvelle France;;;93048;93100;MONTREUIL;67;20;;M;Masculin;E;Externe;1;France;99;Non renseigné (inconnu ou sans objet);A;Contrat d'apprentissage;63;1ERE ANNEE IUT;99;2EME ANNEE DUT (STATUT APPRENTISSAGE);93;93032;93220;GAGNY;5829C;75;75110;0932214B
11/12;40025207;Maintenance des véhicules automobiles option : voitures particulières (BAC PRO);4;BAC PRO;252;Moteurs et mécanique auto;Moteurs et mécanique auto;107;Fédération Francaise de la Carrosserie;146;CFA carrosserie;10;36;2;289;0921667M;Local du CFA;CFA de la Carrosserie;65 boulevard Galliéni;;;92078;92390;VILLENEUVE-LA-GARENNE;10;22;;M;Masculin;E;Externe;1;France;99;Non renseigné (inconnu ou sans objet);A;Contrat d'apprentissage;39;TERMINALE DE BEP OU 2EME ANNEE CAP EN 2 ANS (en lycée);39;TERMINALE DE BEP OU 2EME ANNEE CAP EN 2 ANS (en lycée);92;92026;92400;COURBEVOIE;4511Z;92;92004;92
11/12;13533111;Sciences des organisations : économie de la santé et des politiques sociales, spécialité économie et gestion de la santé (MASTER DAUPHINE);1;MASTER PRO;331;Santé;Santé, sanitaire et social;208;LEEM Apprentissage;362;CFA LEEM apprentissage;17;12;1;2397;0755202X;UFA (L6232-8);Université Paris IX Dauphine;Place du Maréchal de Lattre de Tassigny;;;75116;75016;PARIS 16;17;25;;M;Masculin;E;Externe;1;France;99;Non renseigné (inconnu ou sans objet);A;Contrat d'apprentissage;69;AUTRE SCOLARITE SUPERIEURE;69;AUTRE SCOLARITE SUPERIEURE;92;92049;92120;MONTROUGE;7320Z;92;92014;92
11/12;40034301;Hygiène-environnement (BAC PRO);4;BAC PRO;343;Nettoyage, assainissement, protection de l'environnement;Hygiène, propreté et environnement;46;Institut National de l'Hygiène et du Nettoyage Industriel;49;CFA Environnement et Hygiène des Locaux;3;24;1;88;0941925G;Local du CFA;CFA Environnement et Hygiène des Locaux;34 boulevard Gorki;;;94076;94800;VILLEJUIF;3;30;;F;Féminin;E;Externe;3;Autre;99;Non renseigné (inconnu ou sans objet);A;Contrat d'apprentissage;9;AUTRE SPECIAL MEDICO EDUCATIF (,IME,IMP) (en collège);89;1ERE ANNEE BAC PRO OU BT (STATUT APPRENTISSAGE);75;75115;75015;PARIS;8121Z;93;93010;0941925G
11/12;50031216;Employé de vente spécialisé option B : produits d'équipement courant (CAP);5;CAP;312;Commerce, vente;Commerce, vente;121;Association Francilienne de Formation Interprofessionnelle pour le Développement de l'Apprentissage;160;CFA de l' AFFIDA;27;24;2;335;0783553N;Annexe du CFA;AFFIDA - Centre de la Verrière;4 rue Louis Lormand;;;78644;78320;LA-VERRIERE;27;17;N;M;Masculin;E;Externe;1;France;99;Non renseigné (inconnu ou sans objet);A;Contrat d'apprentissage;23;3EME GENERALE (en collège);71;CAP, BEP OU AUTRE NIVEAU V EN 1 AN (en collège);78;78383;78310;MAUREPAS;4751Z;78;78168;0951947A
11/12;32032002;Communication (BTS);3;BTS;320;Spécialités plurivalentes de la communication;Communication;53;Institut de Gestion Sociale;61;CFA Institut de Gestion Sociale;61;24;1;103;0754738T;Annexe du CFA;CFA Bureautique Appliquée;7 rue Pierre Dupont;;;75110;75010;PARIS;61;22;N;F;Féminin;X;Interne/Externe;1;France;99;Non renseigné (inconnu ou sans objet);A;Contrat d'apprentissage;67;1ER CYCLE UNIVERSITAIRE (DEUG...);67;1ER CYCLE UNIVERSITAIRE (DEUG...);77;77243;77400;LAGNY-SUR-MARNE;4910Z;75;75110;75
11/12;17021001;Ingénieur AgroParisTech : institut des sciences et industries du vivant et de l'environnement.;1;ING;210;Spécialités plurivalentes de l'agronomie et de l'agriculture;Agriculture, espaces verts, élevage et soins des animaux;108;Association pour le Développement de l'Apprentissage dans les Sciences et Technologies du Vivant;147;CFA SEV;1;24;2;290;0754739U;Convention L6231-3;Agroparistech;16 rue Claude Bernard;;;75105;75005;PARIS;1;22;;F;Féminin;E;Externe;1;France;99;Non renseigné (inconnu ou sans objet);A;Contrat d'apprentissage;69;AUTRE SCOLARITE SUPERIEURE;69;AUTRE SCOLARITE SUPERIEURE;94;94021;94550;CHEVILLY-LARUE;2042Z;94;94021;75
11/12;32033104;Prothésiste orthésiste (BTS);3;BTS;331;Santé;Santé, sanitaire et social;133;PARIS-ACADEMIE-ENTREPRISES;176;CFA Paris Académie Entreprises;69;36;1;1324;0750650Z;UFA (L6232-8);Lycée d'Alembert;22 sentes des Dorées;;;75119;75019;PARIS;69;18;;M;Masculin;E;Externe;1;France;99;Non renseigné (inconnu ou sans objet);A;Contrat d'apprentissage;999;INCONNUE;53;TERMINALE TECHNOLOGIQUE (en lycée);91;91534;91400;SACLAY;4646Z;99;99999;993
11/12;32032204;Edition (BTS);3;BTS;322;Techniques de l'imprimerie et de l'édition;Imprimerie, édition, librairie;69;Association Nationale pour la Formation et le Perfectionnement professionnel dans les métiers de l'Edition;101;CFA de l'édition;1;24;1;177;0754816C;Local du CFA;CFA de l'Edition;21 rue Charles Fourier;;;75113;75013;PARIS;1;20;N;F;Féminin;E;Externe;1;France;99;Non renseigné (inconnu ou sans objet);A;Contrat d'apprentissage;67;1ER CYCLE UNIVERSITAIRE (DEUG...);111;EMPLOI (Y COMPRIS CES);92;92040;92130;ISSY-LES-MOULINEAUX;5811Z;92;92040;75
11/12;56033103;Auxiliaire de puériculture (DIPLOME ETAT Niveau V);5;DIV-5;331;Santé;Santé, sanitaire et social;120;Association pour la Formation par l'Apprentissage des Personnels de l'Hôspitalisation Privée d'Ile de France;159;CFA des métiers de la santé et de la solidarité;47;18;2;1503;0921980C;UFA (L6232-8);Institut Formation Soins Infirmiers - Centre Hospitalier Max-Fourestier;102 boulevard Aimé Césaire;;;92050;92014;NANTERRE;47;20;;F;Féminin;E;Externe;1;France;99;Non renseigné (inconnu ou sans objet);A;Contrat d'apprentissage;53;TERMINALE TECHNOLOGIQUE (en lycée);75;2EME ANNEE CAP OU AUTRE DIPLOME DE NIVEAU V (STATUT APPRENTISSAGE);92;92004;92600;ASNIERES-SUR-SEINE;8411Z;92;92004;0754678C
11/12;50033610;Coiffure (CAP);5;CAP;336;Coiffure, esthétique, et autres spécialités des services aux personnes;Coiffure, esthétique;138;Chambre de Métiers et de l'Artisanat des Yvelines;126;CFA de la Chambre de Métiers et de l'Artisanat des Yvelines;41;24;1;223;0780424M;Local du CFA;CFA de la CMA du 78;17 avenue du Général Mangin;;;78646;78000;VERSAILLES;41;16;;F;Féminin;E;Externe;1;France;99;Non renseigné (inconnu ou sans objet);A;Contrat d'apprentissage;23;3EME GENERALE (en collège);23;3EME GENERALE (en collège);78;78498;78300;POISSY;9602A;78;78498;74
11/12;16031203;Diplôme de l'institut international de commerce et de distribution de Paris (ICD);1;DIV-1;312;Commerce, vente;Commerce, vente;53;Institut de Gestion Sociale;61;CFA Institut de Gestion Sociale;43;24;1;103;0754738T;Annexe du CFA;CFA Bureautique Appliquée;7 rue Pierre Dupont;;;75110;75010;PARIS;43;23;N;F;Féminin;X;Interne/Externe;1;France;99;Non renseigné (inconnu ou sans objet);A;Contrat d'apprentissage;105;APPRENTISSAGE BAC+3 (STATUT APPRENTISSAGE);105;APPRENTISSAGE BAC+3 (STATUT APPRENTISSAGE);77;77479;77360;VAIRES-SUR-MARNE;4711F;77;77255;75
11/12;40025509;Technicien du froid et du conditionnement d'air (BAC PRO);4;BAC PRO;255;Electricité, électronique (non compris automatismes, productique);Électricité, électronique;63;Chambre de Commerce et d'Industrie de Paris;237;CFA CCIP - Centre des formations industrielles;67;36;1;660;0941906L;Annexe du CFA;Site CFI Orly;5 place de la Gare des Saules;;;94054;94310;ORLY;67;17;;M;Masculin;I;Interne;2;Communauté Européenne;82;Personne sans activité professionnelle;A;Contrat d'apprentissage;23;3EME GENERALE (en collège);13;CPA OU CLIPA DE CFA;94;94077;94290;VILLENEUVE-LE-ROI;4669C;94;94017;0941906L
11/12;25025518;Automatique et informatique industrielle spé systèmes embarqués (LP Versailles);2;LICENCE PRO;255;Electricité, électronique (non compris automatismes, productique);Électricité, électronique;57;Chambre de Commerce et d'Industrie de Versailles Val d'Oise - Yvelines;75;CFA de la CCIV-Centre R. Delorozoy;24;12;1;124;0781809T;Local du CFA;CFA CCIV - IFA Robert-Delorozoy;7 avenue des Trois Peuples;;;78423;78180;MONTIGNY-LE-BRETONNEUX;24;23;;M;Masculin;E;Externe;1;France;99;Non renseigné (inconnu ou sans objet);A;Contrat d'apprentissage;61;2EME ANNEE BTS (en lycée);61;2EME ANNEE BTS (en lycée);78;78517;78120;RAMBOUILLET;7219Z;91;91471;78
11/12;;Responsable en management et direction des ressources humaines (IGS);1;TH1-N;315;Ressources humaines, gestion du personnel, gestion de l'emploi;Gestion des ressources humaines;53;Institut de Gestion Sociale;61;CFA Institut de Gestion Sociale;50;15;1;102;0752944T;Local du CFA;CFA Bureautique Appliquée;12 rue Alexandre Parodi;;;75110;75010;PARIS;50;24;N;F;Féminin;X;Interne/Externe;1;France;99;Non renseigné (inconnu ou sans objet);A;Contrat d'apprentissage;69;AUTRE SCOLARITE SUPERIEURE;69;AUTRE SCOLARITE SUPERIEURE;91;91201;91210;DRAVEIL;4511Z;78;78621;75
11/12;13525101;Sciences et technologies : sciences pour l'ingénieur mécanique et ses couplages (MASTER Paris 10);1;MASTER PRO;251;Mécanique générale et de précision, usinage;Mécanique générale et de précision, usinage;14;Association pour la Formation Universitaire par l'Apprentissage;14;CFA SUP 2000;187;12;1;1480;0920956P;Convention L6231-3;Université Paris Ouest Nanterre La Défense - UFR Sitec;1 chemin Desvallières;;;92077;92410;VILLE-D'AVRAY;187;22;;F;Féminin;E;Externe;1;France;99;Non renseigné (inconnu ou sans objet);A;Contrat d'apprentissage;105;APPRENTISSAGE BAC+3 (STATUT APPRENTISSAGE);105;APPRENTISSAGE BAC+3 (STATUT APPRENTISSAGE);78;78356;78114;MAGNY-LES-HAMEAUX;2910Z;78;78297;993
11/12;50033610;Coiffure (CAP);5;CAP;336;Coiffure, esthétique, et autres spécialités des services aux personnes;Coiffure, esthétique;60;Institut de Formation et de Perfectionnement aux Métiers;83;CFA de l'Institut de Formation et de Perfectionnement aux Métiers;2;24;1;133;0922275Y;Local du CFA;CFA IFPM;4 boulevard du Levant;;;92050;92000;NANTERRE;2;17;;F;Féminin;E;Externe;1;France;99;Non renseigné (inconnu ou sans objet);A;Contrat d'apprentissage;23;3EME GENERALE (en collège);23;3EME GENERALE (en collège);92;92071;92330;SCEAUX;9602A;92;92071;993
11/12;35031004;Gestion administrative et commerciale (DUT);3;DUT;310;Spécialités plurivalentes des échanges et de la gestion (y compris administr. générale des entreprises et collectivités);Administration et management des entreprises;56;Association pour la Promotion et la Gestion d'un Centre d'Enseignement Supérieur par l'Apprentissage à Evry;69;CFA d' Évry Val d'Essonne;125;24;1;2568;0932214B;Convention L6231-3;IUT de Montreuil;Université Paris 8;140 rue de la nouvelle France;;93048;93100;MONTREUIL;125;22;;F;Féminin;E;Externe;1;France;99;Non renseigné (inconnu ou sans objet);A;Contrat d'apprentissage;53;TERMINALE TECHNOLOGIQUE (en lycée);53;TERMINALE TECHNOLOGIQUE (en lycée);91;91228;91000;EVRY;6512Z;93;93048;993
11/12;56033103;Auxiliaire de puériculture (DIPLOME ETAT Niveau V);5;DIV-5;331;Santé;Santé, sanitaire et social;133;PARIS-ACADEMIE-ENTREPRISES;176;CFA Paris Académie Entreprises;43;24;2;1324;0750650Z;UFA (L6232-8);Lycée d'Alembert;22 sentes des Dorées;;;75119;75019;PARIS;43;19;;F;Féminin;E;Externe;1;France;99;Non renseigné (inconnu ou sans objet);A;Contrat d'apprentissage;999;INCONNUE;73;1ERE ANNEE CAP OU AUTRE DIPLOME DE NIVEAU V (STATUT APPRENTISSAGE);77;77053;77170;BRIE-COMTE-ROBERT;8411Z;75;75112;0754850P
11/12;40025509;Technicien du froid et du conditionnement d'air (BAC PRO);4;BAC PRO;255;Electricité, électronique (non compris automatismes, productique);Électricité, électronique;63;Chambre de Commerce et d'Industrie de Paris;237;CFA CCIP - Centre des formations industrielles;67;36;2;660;0941906L;Annexe du CFA;Site CFI Orly;5 place de la Gare des Saules;;;94054;94310;ORLY;67;18;;M;Masculin;I;Interne;1;France;61;Ouvrier qualifié;A;Contrat d'apprentissage;23;3EME GENERALE (en collège);89;1ERE ANNEE BAC PRO OU BT (STATUT APPRENTISSAGE);95;95574;95390;SAINT-PRIX;7112B;95;95203;0941906L
11/12;40031202;Commerce (BAC PRO);4;BAC PRO;312;Commerce, vente;Commerce, vente;63;Chambre de Commerce et d'Industrie de Paris;239;CFA CCIP - Ecole GREGOIRE - FERRANDI;42;36;1;1976;0752280W;Annexe du CFA;Ecole Grégoire Ferrandi;28 rue de l'Abbé Grégoire;;;75106;75006;PARIS;42;16;;F;Féminin;D;Demi-pensionnaire;1;France;56;Personnel, service direct aux particuliers;A;Contrat d'apprentissage;23;3EME GENERALE (en collège);23;3EME GENERALE (en collège);27;27229;27000;EVREUX;4724Z;75;75115;27
11/12;26031001;Diplôme de l'école ESSEC;2;DIV-2;310;Spécialités plurivalentes des échanges et de la gestion (y compris administr. générale des entreprises et collectivités);Administration et management des entreprises;67;Association pour la Formation par l'Apprentissage CCIV - ESSEC;99;CFA ESSEC;1;24;2;175;0951929F;Convention L6231-3;ESSEC;Avenue Bernard Hirsch;;;95500;95000;PONTOISE;1;26;;F;Féminin;D;Demi-pensionnaire;1;France;99;Non renseigné (inconnu ou sans objet);A;Contrat d'apprentissage;69;AUTRE SCOLARITE SUPERIEURE;107;APPRENTISSAGE BAC+4 (STATUT APPRENTISSAGE);78;78172;78700;CONFLANS-SAINTE-HONORINE;6202A;92;92009;0951929F
11/12;32033414;Hôtellerie, restauration option A : mercatique et gestion hôtelière (BTS);3;BTS;334;Accueil, hôtellerie, tourisme;Accueil, hôtellerie, tourisme;6;Association pour le Développement de la Formation dans les Professions du Commerce;6;CFA Stephenson;52;24;2;10;0752206R;Local du CFA;CFA Stephenson;48 rue Stephenson;;;75118;75018;PARIS;52;21;;F;Féminin;E;Externe;1;France;99;Non renseigné (inconnu ou sans objet);A;Contrat d'apprentissage;69;AUTRE SCOLARITE SUPERIEURE;93;1ERE ANNEE BTS (STATUT APPRENTISSAGE);93;93051;93160;NOISY-LE-GRAND;7830Z;92;92050;0752206R
11/12;25031006;Management des organisations spé management de la qualité : industrie, services, santé (LP Evry);2;LICENCE PRO;310;Spécialités plurivalentes des échanges et de la gestion (y compris administr. générale des entreprises et collectivités);Administration et management des entreprises;56;Association pour la Promotion et la Gestion d'un Centre d'Enseignement Supérieur par l'Apprentissage à Evry;69;CFA d' Évry Val d'Essonne;61;12;1;569;0911990U;Convention L6231-3;Université d'Evry Val-d'Essonne - IUT d'Evry;Centre Romero;Cours Monseigneur Romero;;91228;91000;EVRY;61;23;;M;Masculin;E;Externe;1;France;99;Non renseigné (inconnu ou sans objet);A;Contrat d'apprentissage;111;EMPLOI (Y COMPRIS CES);111;EMPLOI (Y COMPRIS CES);77;77445;77176;SAVIGNY-LE-TEMPLE;2910Z;78;78498;993
11/12;25025102;Gestion de la production industrielle spé ingénierie simultanée, CFAO ou CAO/UGV (LP Mulhouse);2;LICENCE PRO;251;Mécanique générale et de précision, usinage;Mécanique générale et de précision, usinage;56;Association pour la Promotion et la Gestion d'un Centre d'Enseignement Supérieur par l'Apprentissage à Evry;69;CFA d' Évry Val d'Essonne;64;12;1;569;0911990U;Convention L6231-3;Université d'Evry Val-d'Essonne - IUT d'Evry;Centre Romero;Cours Monseigneur Romero;;91228;91000;EVRY;64;21;;M;Masculin;E;Externe;3;Autre;99;Non renseigné (inconnu ou sans objet);A;Contrat d'apprentissage;113;CHOMAGE;113;CHOMAGE;91;91286;91350;GRIGNY;7112B;91;91064;993
11/12;32031303;Professions immobilières (BTS);3;BTS;313;Finances, banque, assurances;Finances, banque, assurances, immobilier;133;PARIS-ACADEMIE-ENTREPRISES;176;CFA Paris Académie Entreprises;60;24;1;1629;0752559Z;UFA (L6232-8);CEFLU;9 rue Chaptal;;;75107;75009;PARIS;60;20;;M;Masculin;D;Demi-pensionnaire;1;France;99;Non renseigné (inconnu ou sans objet);A;Contrat d'apprentissage;51;TERMINALE GENERALE (en lycée);51;TERMINALE GENERALE (en lycée);75;75119;75019;PARIS;6831Z;75;75117;993
11/12;40033402;Restauration (BAC PRO);4;BAC PRO;334;Accueil, hôtellerie, tourisme;Accueil, hôtellerie, tourisme;116;Association Trajectoire Formation;155;CFA TRAJECTOIRE;12;36;2;599;0910843X;Convention L6231-3;Institut Saint-Pierre;29 bis rue des Godeaux;;;91114;91800;BRUNOY;12;21;N;F;Féminin;E;Externe;1;France;99;Non renseigné (inconnu ou sans objet);A;Contrat d'apprentissage;91;2EME ANNEE BAC PRO OU BT (STATUT APPRENTISSAGE);91;2EME ANNEE BAC PRO OU BT (STATUT APPRENTISSAGE);91;91201;91210;DRAVEIL;5510Z;91;91201;91
11/12;25022218;Industries chimiques et pharmaceutiques spé microbiologie industrielle et biotechnologie (LP Paris 7);2;LICENCE PRO;222;Transformations chimiques et apparentées (y compris industrie pharmaceutique);Chimie (parfum, cosmétique, pétrole, traitement de l'eau...);208;LEEM Apprentissage;362;CFA LEEM apprentissage;11;12;1;2395;0752738U;UFA (L6232-8);Université Paris VII;5 rue Thomas Mann;;;75113;75013;PARIS;11;21;;F;Féminin;E;Externe;1;France;99;Non renseigné (inconnu ou sans objet);A;Contrat d'apprentissage;61;2EME ANNEE BTS (en lycée);61;2EME ANNEE BTS (en lycée);95;95574;95390;SAINT-PRIX;2014Z;28;28140;89
11/12;55321401;Travaux d'aménagements paysagers, spécialité travaux de création et d'entretien (BPA 5);5;BPA5;214;Aménagement paysager (parcs, jardins, espaces verts, terrains de sport);Agriculture, espaces verts, élevage et soins des animaux;132;Association pour le Développement de l'Apprentissage Francilien Agricole;175;CFA des Métiers de l'Agriculture - ADAFA;76;24;1;297;0931654T;Convention L6231-3;Lycée du Paysage et de l'Environnement Fénelon;1 rue de Montauban;;;93074;93410;VAUJOURS;76;15;N;M;Masculin;D;Demi-pensionnaire;1;France;52;Employé civil - agent service fonction publique;A;Contrat d'apprentissage;25;3EME D'INSERTION;25;3EME D'INSERTION;77;77193;77165;FORFRY;8130Z;77;77437;77
11/12;13511103;Sciences, technologies, santé : sciences des matériaux spé méthodes physico-chimiques d'élaboration caractérisation des matériaux microsystèmes en couches minces (MASTER Paris 11);1;MASTER PRO;111;Physique-chimie;Mathématiques et sciences;17;Association Union Université Economie;18;CFA Union des Universités;57;24;2;567;0912231F;Convention L6231-3;Faculté des Sciences d'Orsay;15 rue Georges Clémenceau;;;91471;91400;ORSAY;57;23;N;M;Masculin;E;Externe;1;France;99;Non renseigné (inconnu ou sans objet);A;Contrat d'apprentissage;69;AUTRE SCOLARITE SUPERIEURE;107;APPRENTISSAGE BAC+4 (STATUT APPRENTISSAGE);99;99999;78830;;2651B;91;91345;0912231F
11/12;32031209;Management des unités commerciales (BTS);3;BTS;312;Commerce, vente;Commerce, vente;93;Association de Formation de la Grande Distribution;131;CFA Commerce Distribution  Services - CODIS;24;24;1;2042;0754471C;Local du CFA;CFA CODIS;3 rue Pierre Dupont;;;75110;75010;PARIS;24;19;N;F;Féminin;X;Interne/Externe;1;France;99;Non renseigné (inconnu ou sans objet);A;Contrat d'apprentissage;49;1ERE GENERALE OU TECHNOLOGIQUE (en lycée);51;TERMINALE GENERALE (en lycée);94;94068;94100;SAINT-MAUR-DES-FOSSES;7010Z;92;92024;75
11/12;32031405;Assistant de gestion de PME-PMI (BTS);3;BTS;314;Comptabilité, gestion;Comptabilité, gestion;54;Association de Gestion des Formations en Alternance pour les PME;62;CFA PME apprentissage;2;24;1;106;0753268V;Convention L6231-3;Lycée Jean-Lurçat;48 avenue des Gobelins;;;75113;75013;PARIS;2;18;;F;Féminin;D;Demi-pensionnaire;1;France;99;Non renseigné (inconnu ou sans objet);X;Contrat en cours d'enregistrement par la DDTE (ou autres services d'enregistrement);45;TERMINALE PROFESSIONNELLE (2EME ANNEE BAC PRO OU BT) (en lycée);45;TERMINALE PROFESSIONNELLE (2EME ANNEE BAC PRO OU BT) (en lycée);94;94033;94120;FONTENAY-SOUS-BOIS;3600Z;94;94042;993
11/12;;Expert-gestionnaire en hôtellerie internationale (IMHI) (TH);1;TH1-C;334;Accueil, hôtellerie, tourisme;Accueil, hôtellerie, tourisme;67;Association pour la Formation par l'Apprentissage CCIV - ESSEC;99;CFA ESSEC;3;24;2;175;0951929F;Convention L6231-3;ESSEC;Avenue Bernard Hirsch;;;95500;95000;PONTOISE;3;26;;M;Masculin;D;Demi-pensionnaire;3;Autre;99;Non renseigné (inconnu ou sans objet);A;Contrat d'apprentissage;69;AUTRE SCOLARITE SUPERIEURE;107;APPRENTISSAGE BAC+4 (STATUT APPRENTISSAGE);75;75113;75013;PARIS;5629A;78;78297;0951929F
11/12;13522211;Sciences, technologies, santé : medicaments et autres produits de santé spé qualité et produits de santé (MASTER Paris 11);1;MASTER PRO;222;Transformations chimiques et apparentées (y compris industrie pharmaceutique);Chimie (parfum, cosmétique, pétrole, traitement de l'eau...);208;LEEM Apprentissage;362;CFA LEEM apprentissage;18;12;1;2670;0921810T;UFA (L6232-8);Unité de Formation et de Recherche en Pharmacie;5 rue Jean Baptiste Clément;;;92019;92290;CHATENAY-MALABRY;18;25;;F;Féminin;E;Externe;1;France;99;Non renseigné (inconnu ou sans objet);A;Contrat d'apprentissage;69;AUTRE SCOLARITE SUPERIEURE;69;AUTRE SCOLARITE SUPERIEURE;75;75115;75015;PARIS;2120Z;94;94046;92
11/12;;Manager marketing international (groupe ESSEC);1;TH1-C;312;Commerce, vente;Commerce, vente;67;Association pour la Formation par l'Apprentissage CCIV - ESSEC;99;CFA ESSEC;8;15;1;175;0951929F;Convention L6231-3;ESSEC;Avenue Bernard Hirsch;;;95500;95000;PONTOISE;8;24;;F;Féminin;D;Demi-pensionnaire;1;France;99;Non renseigné (inconnu ou sans objet);A;Contrat d'apprentissage;69;AUTRE SCOLARITE SUPERIEURE;69;AUTRE SCOLARITE SUPERIEURE;75;75110;75010;PARIS;6202A;92;92009;993
11/12;;Technicien supérieur en maintenance informatique et réseaux (TITRE PRO Niv 3 IPI);3;TH3-N;326;Informatique, traitement de l'information, réseaux de transmission des données;Informatique, réseaux;53;Institut de Gestion Sociale;61;CFA Institut de Gestion Sociale;68;24;2;102;0752944T;Local du CFA;CFA Bureautique Appliquée;12 rue Alexandre Parodi;;;75110;75010;PARIS;68;23;N;M;Masculin;X;Interne/Externe;1;France;99;Non renseigné (inconnu ou sans objet);A;Contrat d'apprentissage;109;CONTRAT DE PROFESSIONNALISATION;109;CONTRAT DE PROFESSIONNALISATION;92;92002;92160;ANTONY;6130Z;92;92040;75
11/12;;Photographe (BTM);4;TH4-M;323;Techniques de l'image et du son, métiers connexes du spectacle;Techniques de l'image et du son, métiers connexes du spectacle;92;Chambre de Métiers et de l'Artisanat de la Seine St Denis;130;CFA Campus des Métiers et de l'Entreprise;72;36;2;2112;0931618D;Local du CFA;CFA Campus des Métiers et de l'Entreprise;91-129 rue Edouard Renard;;;93008;93013;BOBIGNY;72;19;N;F;Féminin;E;Externe;1;France;55;Employé de commerce;A;Contrat d'apprentissage;53;TERMINALE TECHNOLOGIQUE (en lycée);77;3EME ANNEE CAP OU AUTRE DIPLOME DE NIVEAU V (STATUT APPRENTISSAGE);95;95509;95380;PUISEUX-EN-FRANCE;7420Z;92;92049;0931618D
11/12;63199999;DIMA - Dispositif d'Initiation aux Métiers en Alternance (DIMA);6;DIMA;999;Dispositif d'initiation aux métiers en alternance;Dispositif d'initiation aux métiers en alternance;100;Association de Gestion des Centres de Formation d'Apprentis Saint-Jean;139;CFA Saint-Jean;29;12;1;279;0952110C;Annexe du CFA;CFA Saint-Jean - Site de Butry;15 rue du Port aux Loups;;;95120;95430;BUTRY-SUR-OISE;29;14;N;M;Masculin;D;Demi-pensionnaire;1;France;99;Non renseigné (inconnu ou sans objet);DIMA;Dispositif d'Initiation aux Métiers en Alternance;5;5EME;5;5EME;95;95199;95330;DOMONT;;;;95
